{
  "scope": "@ogimagecn",
  "name": "OG Image CN",
  "homepage": "https://ogimagecn.vercel.app",
  "registryBaseUrl": "https://ogimagecn.vercel.app/r",
  "registryIndexPath": "/registry.json",
  "componentUrlPattern": "https://ogimagecn.vercel.app/r/{name}.json",
  "description": "Customizable Open Graph image components for React, installed through the shadcn CLI.",
  "descriptionLong": "OG Image CN is a shadcn-compatible registry of Open Graph image components for React. The CLI copies each template into your codebase so you can change its layout, content, and metadata without a separate design tool.",
  "githubUrl": "https://github.com/Aniket-508/ogimagecn",
  "githubUsername": "Aniket-508",
  "distribution": "open-source",
  "categories": [
    "react",
    "nextjs",
    "tailwind",
    "shadcn-registry",
    "component-library"
  ],
  "installExample": "npx shadcn@latest add @ogimagecn/simple",
  "sampleComponents": ["simple"],
  "features": [
    "The shadcn CLI copies components into your repository",
    "Customizable OG image templates",
    "Built for React and Next.js metadata APIs"
  ]
}
